x	y	cut_x	y_label_idx
邢台明天是晴天吗	Weather-Query	邢台 明天 是 晴天 吗	11
吉林未来一周的天气查一下	Weather-Query	吉林 未来 一周 的 天气 查 一下	11
查询周五长春是晴天吗	Weather-Query	查询 周五 长春 是 晴天 吗	11
明天杭州有雨吗	Weather-Query	明天 杭州 有雨 吗	11
明天青藏可能会降雨吗	Weather-Query	明天 青藏 可能 会 降雨 吗	11
查询明天乌鲁木齐湿度正常吗	Weather-Query	查询 明天 乌鲁木齐 湿度 正常 吗	11
查询未来一周珠海天气	Weather-Query	查询 未来 一周 珠海 天气	11
上周广州空气质量怎么样	Weather-Query	上周 广州 空气质量 怎么样	11
查询明天兰州气温如何	Weather-Query	查询 明天 兰州 气温 如何	11
查询云南下月降雪情况	Weather-Query	查询 云南 下 月 降雪 情况	11
帮我查下新西兰现在的平均气温	Weather-Query	帮 我 查下 新西兰 现在 的 平均气温	11
近期日照气温会偏高吗	Weather-Query	近期 日照 气温 会 偏 高 吗	11
查询后天广州会下雨吗	Weather-Query	查询 后天 广州 会 下雨 吗	11
想去植物园，这周末天气怎么样呢？	Weather-Query	想 去 植物园 ， 这 周末 天气 怎么样 呢 ？	11
今天沈阳适合穿什么衣服	Weather-Query	今天 沈阳 适合 穿 什么 衣服	11
告诉我下周河北的空气湿度	Weather-Query	告诉 我 下周 河北 的 空气 湿度	11
天气好冷图们是不是今天降温了	Weather-Query	天气 好 冷 图们 是不是 今天 降温 了	11
烟台星期四紫外线指数为5	Weather-Query	烟台 星期四 紫外线 指数 为 5	11
石家庄的气温会较稳定吗	Weather-Query	石家庄 的 气温 会 较 稳定 吗	11
查询播放未来一周哈尔滨天气状况	Weather-Query	查询 播放 未来 一周 哈尔滨 天气状况	11
周三杭州有雨吗	Weather-Query	周三 杭州 有雨 吗	11
烟台什么时候会下雨？	Weather-Query	烟台 什么 时候 会 下雨 ？	11
益阳在明天是否需要添加衣物。	Weather-Query	益阳 在 明天 是否 需要 添加 衣物 。	11
明天早上有霜吗	Weather-Query	明天 早上 有霜 吗	11
查询杭州气温变化	Weather-Query	查询 杭州 气温 变化	11
8月3号白洋淀下雨吗	Weather-Query	8 月 3 号 白洋淀 下雨 吗	11
井冈山后天早上气温低吗？要多加衣物吗？	Weather-Query	井冈山 后天 早上 气温 低 吗 ？ 要 多加 衣物 吗 ？	11
最近河南气候怎么样	Weather-Query	最近 河南 气候 怎么样	11
丽江的天气偏热吗	Weather-Query	丽江 的 天气 偏热 吗	11
石家庄的紫外线变化大吗	Weather-Query	石家庄 的 紫外线 变化 大 吗	11
查一下银川今天有没有雨啊	Weather-Query	查 一下 银川 今天 有没有 雨 啊	11
详细播报明早湖北的天气情况	Weather-Query	详细 播报 明早 湖北 的 天气情况	11
巴黎是不是每天都会下雨呢？	Weather-Query	巴黎 是不是 每天 都 会 下雨 呢 ？	11
查询暴雨几点下啊别给我淋路上	Weather-Query	查询 暴雨 几点 下 啊 别 给 我 淋 路上	11
石家庄的空气质量稳定吗	Weather-Query	石家庄 的 空气质量 稳定 吗	11
广州下周三温度下降吗	Weather-Query	广州 下周三 温度 下降 吗	11
查询下周日海南会下雨吗	Weather-Query	查询 下周日 海南 会 下雨 吗	11
查询厦门上月有下雪吗	Weather-Query	查询 厦门 上 月 有 下雪 吗	11
紫外线指数多少怎么样	Weather-Query	紫外线 指数 多少 怎么样	11
查询铁岭紫外线会偏高吗	Weather-Query	查询 铁岭 紫外线 会 偏 高 吗	11
查询播放周三绍兴是晴天吗	Weather-Query	查询 播放 周三 绍兴 是 晴天 吗	11
澳门空气质量一般吗	Weather-Query	澳门 空气质量 一般 吗	11
查询近期高雄气温会日渐升高吗	Weather-Query	查询 近期 高雄 气温 会 日渐 升高 吗	11
广东明天暖和吗，不穿棉袄可以吗？	Weather-Query	广东 明天 暖和 吗 ， 不 穿 棉袄 可以 吗 ？	11
10号佳木斯会不会下雨	Weather-Query	10 号 佳木斯 会 不会 下雨	11
查询沈阳近期会大面积降雨吗	Weather-Query	查询 沈阳 近期 会 大面积 降雨 吗	11
株洲今天阴转多云吗	Weather-Query	株洲 今天 阴转多云 吗	11
香港明天的空气质量是怎么样的	Weather-Query	香港 明天 的 空气质量 是 怎么样 的	11
周末去西湖的话穿什么衣服合适	Weather-Query	周末 去 西湖 的话 穿 什么 衣服 合适	11
今天大连会下雨吗	Weather-Query	今天 大连 会 下雨 吗	11
明天天气适合放风筝吗	Weather-Query	明天 天气 适合 放风筝 吗	11
搜索今天重庆降雨吗	Weather-Query	搜索 今天 重庆 降雨 吗	11
济南冬天经常下雪吗？	Weather-Query	济南 冬天 经常 下雪 吗 ？	11
今天出去玩空气质量会不会影响心情	Weather-Query	今天 出去玩 空气质量 会 不会 影响 心情	11
新疆北部明天会下雨吗	Weather-Query	新疆 北部 明天 会 下雨 吗	11
菏泽明天有西北风吗	Weather-Query	菏泽 明天 有 西北风 吗	11
我明天要去钓鱼，能帮我看一下明天的天气怎么样吗？	Weather-Query	我 明天 要 去 钓鱼 ， 能 帮 我 看 一下 明天 的 天气 怎么样 吗 ？	11
搜索明天东南沿海的空气质量	Weather-Query	搜索 明天 东南 沿海 的 空气质量	11
6月10号浙江会下雨吗	Weather-Query	6 月 10 号 浙江 会 下雨 吗	11
告诉我明天河北哪个地区会降雨	Weather-Query	告诉 我 明天 河北 哪个 地区 会 降雨	11
后天黄山气温会升高吗	Weather-Query	后天 黄山 气温 会 升高 吗	11
我想要知道4月4号天气如何	Weather-Query	我 想要 知道 4 月 4 号 天气 如何	11
听说广州天气比我们这边热，大概多少度啊	Weather-Query	听说 广州 天气 比 我们 这边 热 ， 大概 多少度 啊	11
查询未来一周江西会持续降雨吗	Weather-Query	查询 未来 一周 江西 会 持续 降雨 吗	11
明天株洲有大雨吗	Weather-Query	明天 株洲 有 大雨 吗	11
丽江正在刮大风吗	Weather-Query	丽江 正在 刮 大风 吗	11
查询自贡下月紫外线怎么样	Weather-Query	查询 自贡 下 月 紫外线 怎么样	11
邢台明天是晴天吗	Weather-Query	邢台 明天 是 晴天 吗	11
查询播放周三重庆是晴天吗	Weather-Query	查询 播放 周三 重庆 是 晴天 吗	11
海南明天是晴天吗	Weather-Query	海南 明天 是 晴天 吗	11
上月台湾下冰雹了吗	Weather-Query	上 月 台湾 下 冰雹 了 吗	11
查询邢台穿衣指数	Weather-Query	查询 邢台 穿衣 指数	11
查询岭南可以穿外套出门吗	Weather-Query	查询 岭南 可以 穿 外套 出门 吗	11
明天刮风吗，用不用穿外套	Weather-Query	明天 刮风 吗 ， 用 不用 穿 外套	11
查询丹阳那边空气湿度是不是很低	Weather-Query	查询 丹阳 那边 空气 湿度 是不是 很 低	11
播放江西一周的室外气温	Weather-Query	播放 江西 一周 的 室外 气温	11
我想看后天武汉的风向	Weather-Query	我 想 看 后天 武汉 的 风向	11
丽江正在下雨吗	Weather-Query	丽江 正在 下雨 吗	11
今天香港会下雨吗	Weather-Query	今天 香港 会 下雨 吗	11
福建明天刮风吗	Weather-Query	福建 明天 刮风 吗	11
山西近一周的气温变化情况怎么样	Weather-Query	山西 近 一周 的 气温 变化 情况 怎么样	11
明天不适宜穿半袖吗	Weather-Query	明天 不 适宜 穿 半袖 吗	11
重庆有雨吗	Weather-Query	重庆 有雨 吗	11
郑州下午四点的天气怎么样	Weather-Query	郑州 下午 四点 的 天气 怎么样	11
今天浙江东部可能下雨吗	Weather-Query	今天 浙江 东部 可能 下雨 吗	11
后天下午三点会下雨吗？	Weather-Query	后天 下午 三点 会 下雨 吗 ？	11
明天适合冲浪吗天气怎么样	Weather-Query	明天 适合 冲浪 吗 天气 怎么样	11
邯郸近期气温会逐渐升高吗	Weather-Query	邯郸 近期 气温 会 逐渐 升高 吗	11
我想知道杭州下周的降水情况	Weather-Query	我 想 知道 杭州 下周 的 降水 情况	11
明天保定会下冰雹吗	Weather-Query	明天 保定 会下 冰雹 吗	11
廊坊的紫外线指数多少	Weather-Query	廊坊 的 紫外线 指数 多少	11
大凉山4月平均气温多少	Weather-Query	大凉山 4 月 平均气温 多少	11
帮我查询播放明天澳门室外温度多少度	Weather-Query	帮 我 查询 播放 明天 澳门 室外 温度 多少度	11
山西湿度指数稳定吗	Weather-Query	山西 湿度 指数 稳定 吗	11
3月9日北京有雨吗	Weather-Query	3 月 9 日 北京 有雨 吗	11
杭州西湖景区明天天气好吗	Weather-Query	杭州 西湖 景区 明天 天气 好 吗	11
哈尔滨的湿度较高吗	Weather-Query	哈尔滨 的 湿度 较 高 吗	11
查询一会烟台紫外线会升高吗	Weather-Query	查询 一会 烟台 紫外线 会 升高 吗	11
要去大理散心，那边天气怎么样？	Weather-Query	要 去 大理 散心 ， 那边 天气 怎么样 ？	11
查询明天杭州气温多少	Weather-Query	查询 明天 杭州 气温 多少	11
今天上午会刮风吗？	Weather-Query	今天上午 会 刮风 吗 ？	11
下周一抚顺最高多少度	Weather-Query	下周一 抚顺 最高 多少度	11
北京空气质量是不是较差。	Weather-Query	北京 空气质量 是不是 较差 。	11
廊坊的紫外线会偏高吗	Weather-Query	廊坊 的 紫外线 会 偏 高 吗	11
湘潭明天会下雨吗	Weather-Query	湘潭 明天 会 下雨 吗	11
明晚天津会下雪吗	Weather-Query	明晚 天津 会 下雪 吗	11
西安1月9号气温多少	Weather-Query	西安 1 月 9 号 气温 多少	11
浙江降雨量多少	Weather-Query	浙江 降雨量 多少	11
天气这么干燥查一下湿度多少	Weather-Query	天气 这么 干燥 查 一下 湿度 多少	11
查询明天甘肃最新天气预报	Weather-Query	查询 明天 甘肃 最新 天气预报	11
查询河南穿衣指数多少	Weather-Query	查询 河南 穿衣 指数 多少	11
廊坊上月下雨了吗	Weather-Query	廊坊 上 月 下雨 了 吗	11
新疆室内温差大吗	Weather-Query	新疆 室内 温差 大 吗	11
福建的空气质量如何	Weather-Query	福建 的 空气质量 如何	11
查询五月重庆气温会高吗	Weather-Query	查询 五月 重庆 气温 会 高 吗	11
天池紫外线指数多少用抹防晒不	Weather-Query	天池 紫外线 指数 多少 用 抹 防晒 不	11
下周一有东风没有	Weather-Query	下周一 有 东风 没有	11
上海明天的穿衣指数会很高吗？	Weather-Query	上海 明天 的 穿衣 指数 会 很 高 吗 ？	11
银川明天去用穿羽绒服吗	Weather-Query	银川 明天 去 用 穿 羽绒服 吗	11
明天海南有雨吗	Weather-Query	明天 海南 有雨 吗	11
详细播报明早江西的天气情况	Weather-Query	详细 播报 明早 江西 的 天气情况	11
查询东南沿海这周会有几场雨	Weather-Query	查询 东南 沿海 这 周会 有 几场 雨	11
福建那里晚上有没有台风经过	Weather-Query	福建 那里 晚上 有没有 台风 经过	11
查询义乌昨天是不是下冰雹了	Weather-Query	查询 义乌 昨天 是不是 下 冰雹 了	11
查询明天安徽东部会下雨吗	Weather-Query	查询 明天 安徽 东部 会 下雨 吗	11
今天下午会不会下雨啊	Weather-Query	今天下午 会 不会 下雨 啊	11
周一兰州下雨了吗	Weather-Query	周一 兰州 下雨 了 吗	11
播放明天吉林是否有雨	Weather-Query	播放 明天 吉林 是否 有雨	11
郑州的气温变化大吗	Weather-Query	郑州 的 气温 变化 大 吗	11
北京朝阳区今天白天会有雾霾吗？	Weather-Query	北京 朝阳区 今天 白天 会 有 雾 霾 吗 ？	11
明天保定的会有沙尘暴吗	Weather-Query	明天 保定 的 会 有 沙尘暴 吗	11
查询明天晚上九点邢台有雨吗	Weather-Query	查询 明天 晚上 九点 邢台 有雨 吗	11
查询上海可能会出现降温吗	Weather-Query	查询 上海 可能 会 出现 降温 吗	11
查询最近丽江在刮风吗	Weather-Query	查询 最近 丽江 在 刮风 吗	11
深圳3月19日空气质量好不好？	Weather-Query	深圳 3 月 19 日 空气质量 好不好 ？	11
循环播放近一周的台湾紫外线情况	Weather-Query	循环 播放 近 一周 的 台湾 紫外线 情况	11
沈阳这周会降雨吗	Weather-Query	沈阳 这 周会 降雨 吗	11
明天宁波下雨吗	Weather-Query	明天 宁波 下雨 吗	11
查询长春的空气指数	Weather-Query	查询 长春 的 空气 指数	11
这两天天气湿度大不大啊	Weather-Query	这 两天 天气 湿度 大不大 啊	11
明天的空气污染指数严重不	Weather-Query	明天 的 空气污染 指数 严重 不	11
上海今天刮得是北风吗	Weather-Query	上海 今天 刮得 是 北风 吗	11
查询大连近几天的降雨情况	Weather-Query	查询 大连 近几天 的 降雨 情况	11
12月1日下午新疆会下雨吗？	Weather-Query	12 月 1 日 下午 新疆 会 下雨 吗 ？	11
帮我查询明天杭州的天气	Weather-Query	帮 我 查询 明天 杭州 的 天气	11
查询明天太原可以穿什么	Weather-Query	查询 明天 太原 可以 穿 什么	11
明天天气好吗能春游去不	Weather-Query	明天 天气 好 吗 能 春游 去 不	11
立即搜索邢台紫外线指数	Weather-Query	立即 搜索 邢台 紫外线 指数	11
查一下龙海15号的气温	Weather-Query	查 一下 龙海 15 号 的 气温	11
拉萨明天是不是会下雪？	Weather-Query	拉萨 明天 是不是 会 下雪 ？	11
帮我查询明天珠海室外温度多少度	Weather-Query	帮 我 查询 明天 珠海 室外 温度 多少度	11
这几天要去太原查一下那边空气湿度多少	Weather-Query	这 几天 要 去 太原 查 一下 那边 空气 湿度 多少	11
今年冬天江门还会不会下雪了	Weather-Query	今年冬天 江门 还会 不会 下雪 了	11
明天辽宁会下雪吗？	Weather-Query	明天 辽宁 会 下雪 吗 ？	11
我想知道开原今天是不是要多加衣物防寒保暖。	Weather-Query	我 想 知道 开原 今天 是不是 要 多加 衣物 防寒保暖 。	11
前天平潭气温多少	Weather-Query	前天 平潭 气温 多少	11
我想知道洛阳今晚需不需要多加衣物。	Weather-Query	我 想 知道 洛阳 今晚 需不需要 多加 衣物 。	11
感觉昨天的湿度会不会比今天高	Weather-Query	感觉 昨天 的 湿度 会 不会 比 今天 高	11
今天中午紫外线指数是否会继续上升	Weather-Query	今天 中午 紫外线 指数 是否 会 继续 上升	11
明天天气晴朗吗，想带孩子去花园玩儿	Weather-Query	明天 天气晴朗 吗 ， 想带 孩子 去 花园 玩儿	11
辽阳将会持续大风天气吗	Weather-Query	辽阳 将会 持续 大风 天气 吗	11
昨天大理刮风了吗	Weather-Query	昨天 大理 刮风 了 吗	11
明天是否是大风蓝色预警	Weather-Query	明天 是否是 大风 蓝色 预警	11
哈尔滨的空气质量如何	Weather-Query	哈尔滨 的 空气质量 如何	11
播放最新京都天气状况	Weather-Query	播放 最新 京都 天气状况	11
山东周三会刮风吗	Weather-Query	山东 周三 会 刮风 吗	11
未来一周鞍山有没有雨啊	Weather-Query	未来 一周 鞍山 有没有 雨 啊	11
告诉我后天的紫外线指数	Weather-Query	告诉 我 后天 的 紫外线 指数	11
秦岭周六下冰雹吗	Weather-Query	秦岭 周六 下 冰雹 吗	11
锦州现在适合穿什么衣服	Weather-Query	锦州 现在 适合 穿 什么 衣服	11
查询山西下周会大面积降雨吗	Weather-Query	查询 山西 下周 会 大面积 降雨 吗	11
周一下午三点会下雨吗？	Weather-Query	周一 下午 三点 会 下雨 吗 ？	11
最近南通有没有7级以上大风	Weather-Query	最近 南通 有没有 7 级 以上 大风	11
南阳了哎他那都快儿闷死了	Weather-Query	南阳 了 哎 他 那 都 快儿 闷死 了	11
明天要去开会，帮我看一下明天天气有没有雨好吗？	Weather-Query	明天 要 去 开会 ， 帮 我 看 一下 明天 天气 有没有 雨好 吗 ？	11
请查询播放明天有哪些地区下雨	Weather-Query	请 查询 播放 明天 有 哪些 地区 下雨	11
查询明天江西紫外线会偏高吗	Weather-Query	查询 明天 江西 紫外线 会 偏 高 吗	11
7月去大凉山适合穿什么衣服	Weather-Query	7 月 去 大凉山 适合 穿 什么 衣服	11
周五这边有风吗什么风啊	Weather-Query	周五 这边 有风 吗 什么 风 啊	11
想了解一下10号长沙的温度	Weather-Query	想 了解 一下 10 号 长沙 的 温度	11
帮我查询明天南京室外温度多少度	Weather-Query	帮 我 查询 明天 南京 室外 温度 多少度	11
今天天气变化的厉害，会不会下雪？	Weather-Query	今天天气 变化 的 厉害 ， 会 不会 下雪 ？	11
福建明天有台风吗	Weather-Query	福建 明天 有 台风 吗	11
周三读书会的时候会下暴雨吗？	Weather-Query	周三 读书会 的 时候 会下 暴雨 吗 ？	11
我想了解明天沈阳的气温度数	Weather-Query	我 想 了解 明天 沈阳 的 气温 度数	11
查询下周山东多地是否会降雨加雪	Weather-Query	查询 下周 山东 多地 是否 会 降雨 加雪	11
查询今天无锡有雨吗	Weather-Query	查询 今天 无锡 有雨 吗	11
未来几天佳木斯天气好不好多少度	Weather-Query	未来 几天 佳木斯 天气 好不好 多少度	11
明天悉尼为晴天吗	Weather-Query	明天 悉尼 为 晴天 吗	11
帮我查询一下重庆明天是晴天吗	Weather-Query	帮 我 查询 一下 重庆 明天 是 晴天 吗	11
未来一周吉林有没有雪啊	Weather-Query	未来 一周 吉林 有没有 雪 啊	11
这周重庆有风吗	Weather-Query	这 周 重庆 有风 吗	11
帮我查询明天台北室外温度多少度	Weather-Query	帮 我 查询 明天 台北 室外 温度 多少度	11
查询海南穿衣指数文档	Weather-Query	查询 海南 穿衣 指数 文档	11
过两天是不是要下雪呢	Weather-Query	过 两天 是不是 要 下雪 呢	11
桐城那边现在开始刮西北风了吗	Weather-Query	桐城 那边 现在 开始 刮 西北风 了 吗	11
五大连池近期气温会稳步上升吗	Weather-Query	五大连池 近期 气温 会 稳步 上升 吗	11
香港这周会升温吗	Weather-Query	香港 这 周会 升温 吗	11
我想知道明天济州岛的天气情况	Weather-Query	我 想 知道 明天 济州岛 的 天气情况	11
查询明天内蒙古气温多少	Weather-Query	查询 明天 内蒙古 气温 多少	11
今天的空气湿度是多少	Weather-Query	今天 的 空气 湿度 是 多少	11
明天的合肥天气预报预约一下	Weather-Query	明天 的 合肥 天气预报 预约 一下	11
别担心今天天气还可以我会步行过去	Weather-Query	别 担心 今天天气 还 可以 我会 步行 过去	11
上周北京上空出现了日晕现象	Weather-Query	上周 北京 上空 出现 了 日晕 现象	11
今天下午的天气应该比上午更适合晒衣服	Weather-Query	今天下午 的 天气 应该 比 上午 更 适合 晒衣服	11
帮我看看株洲明天是晴天吗	Weather-Query	帮 我 看看 株洲 明天 是 晴天 吗	11
花莲马上会下雨吗	Weather-Query	花莲 马上会 下雨 吗	11
帮我查一下现在上海的天气	Weather-Query	帮 我查 一下 现在 上海 的 天气	11
今天中午要发传单，穿长袖合适吗	Weather-Query	今天 中午 要 发传单 ， 穿 长袖 合适 吗	11
明天想去商场，天气怎么样啊？	Weather-Query	明天 想 去 商场 ， 天气 怎么样 啊 ？	11
佳木斯的穿衣指数变化大吗	Weather-Query	佳木斯 的 穿衣 指数 变化 大 吗	11
下周六可以穿裙子吗	Weather-Query	下周六 可以 穿 裙子 吗	11
查询上月江西南边下了几场雨	Weather-Query	查询 上 月 江西 南边 下 了 几场 雨	11
帮我查台北今天下午是不是有台风。	Weather-Query	帮 我查 台北 今天下午 是不是 有 台风 。	11
我想知道厦门空气质量是不是比较好。	Weather-Query	我 想 知道 厦门 空气质量 是不是 比较 好 。	11
查查南昌下个星期三是不是晴天呢	Weather-Query	查查 南昌 下个星期 三 是不是 晴天 呢	11
查一下北海今天的最高气温啊	Weather-Query	查 一下 北海 今天 的 最高 气温 啊	11
查询上月玉林下雨天天数	Weather-Query	查询 上 月 玉林 下雨天 天数	11
查询太原近期是否会下冰雹	Weather-Query	查询 太原 近期 是否 会下 冰雹	11
明光市未来两周紫外线指数制成表格	Weather-Query	明光市 未来 两周 紫外线 指数 制成 表格	11
拉萨今天晚上9点会下雨吗	Weather-Query	拉萨 今天 晚上 9 点会 下雨 吗	11
杭州明天是晴天吗	Weather-Query	杭州 明天 是 晴天 吗	11
承德24小时内可能出现小雨转中雨不	Weather-Query	承德 24 小时 内 可能 出现 小雨 转 中雨 不	11
南海气温最高多少度	Weather-Query	南海 气温 最高 多少度	11
查询明天海南岛会下雨吗	Weather-Query	查询 明天 海南岛 会 下雨 吗	11
查询后天甘肃会持续降温吗	Weather-Query	查询 后天 甘肃 会 持续 降温 吗	11
峨眉山市星期一早上八点半要多加衣物吗？	Weather-Query	峨眉山市 星期一 早上 八点半 要 多加 衣物 吗 ？	11
兰州今天空气湿度多少	Weather-Query	兰州 今天 空气 湿度 多少	11
明天要去承德旅行啊，那边天气怎么样？	Weather-Query	明天 要 去 承德 旅行 啊 ， 那边 天气 怎么样 ？	11
未来三天芜湖天气怎么样	Weather-Query	未来 三天 芜湖 天气 怎么样	11
我想知道沈阳下周的降水情况	Weather-Query	我 想 知道 沈阳 下周 的 降水 情况	11
帮我查一下张家口后天晚上的风向。	Weather-Query	帮 我查 一下 张家口 后天 晚上 的 风向 。	11
今天天池最高气温多少	Weather-Query	今天 天池 最高 气温 多少	11
告诉我长沙9月的降雨量变化	Weather-Query	告诉 我 长沙 9 月 的 降雨量 变化	11
今天是个适合郊游的好天气	Weather-Query	今天 是 个 适合 郊游 的 好 天气	11
明天还会刮风吗	Weather-Query	明天 还会 刮风 吗	11
我们家乡夏天的平均室外温度为摄氏25度	Weather-Query	我们 家乡 夏天 的 平均 室外 温度 为 摄氏 25 度	11
告诉我明天云南什么时候降温	Weather-Query	告诉 我 明天 云南 什么 时候 降温	11
明天用穿羽绒服吗	Weather-Query	明天 用 穿 羽绒服 吗	11
新疆夜晚多少度	Weather-Query	新疆 夜晚 多少度	11
江西南昌明天温度有30度	Weather-Query	江西 南昌 明天 温度 有 30 度	11
抚顺今天多少度	Weather-Query	抚顺 今天 多少度	11
8月1日南京适宜穿太厚吗？	Weather-Query	8 月 1 日 南京 适宜 穿太厚 吗 ？	11
查查天津下周日是否有雾霾	Weather-Query	查查 天津 下周日 是否 有雾 霾	11
查询后天邯郸的温度	Weather-Query	查询 后天 邯郸 的 温度	11
查询明天陕西室内湿度会偏高吗	Weather-Query	查询 明天 陕西 室内 湿度 会 偏 高 吗	11
今天武汉是什么天气	Weather-Query	今天 武汉 是 什么 天气	11
打开长春的气温预报	Weather-Query	打开 长春 的 气温 预报	11
搜索查询明早江宁是否会下雨	Weather-Query	搜索 查询 明早 江宁 是否 会 下雨	11
明天学校开运动，天气怎么样？	Weather-Query	明天 学校 开 运动 ， 天气 怎么样 ？	11
听说南京12月2日下冰雹吗	Weather-Query	听说 南京 12 月 2 日下 冰雹 吗	11
宁波可吸入颗粒物指数	Weather-Query	宁波 可吸入颗粒物 指数	11
潍坊湿度是多少	Weather-Query	潍坊 湿度 是 多少	11
昨天唐山市发布灾害性天气预警信号预计出现暴雨大风天气	Weather-Query	昨天 唐山市 发布 灾害性 天气 预警 信号 预计 出现 暴雨 大风 天气	11
最近一周江苏会有大风出现吗	Weather-Query	最近 一周 江苏 会 有 大风 出现 吗	11
不知道三天后是不是要下雨呢	Weather-Query	不 知道 三天 后 是不是 要 下雨 呢	11
报一下明天北京的风向	Weather-Query	报 一下 明天 北京 的 风向	11
黑河明天是晴天吗	Weather-Query	黑河 明天 是 晴天 吗	11
删除宁波前天的风力变化表	Weather-Query	删除 宁波 前天 的 风力 变化 表	11
查询湖州那里下没下过冰雹	Weather-Query	查询 湖州 那里 下 没 下过 冰雹	11
明天合肥会出现雨夹雪吗	Weather-Query	明天 合肥 会 出现 雨夹雪 吗	11
封新城你现在每年都回老家吗	Weather-Query	封 新城 你 现在 每年 都 回老家 吗	11
播放明天的紫外线指数	Weather-Query	播放 明天 的 紫外线 指数	11
衡阳今晚空气湿度高吗	Weather-Query	衡阳 今晚 空气 湿度 高 吗	11
五天后下冰雹吗	Weather-Query	五天 后 下 冰雹 吗	11
登记最近一周青藏的紫外线情况	Weather-Query	登记 最近 一周 青藏 的 紫外线 情况	11
查询下月有雨吗	Weather-Query	查询 下 月 有 雨 吗	11
一会衡水可能会下雨吗	Weather-Query	一会 衡水 可能 会 下雨 吗	11
长沙拍情侣艺术照多少钱一次	Weather-Query	长沙 拍 情侣 艺术照 多少 钱 一次	11
今天石家庄有雨吗	Weather-Query	今天 石家庄 有雨 吗	11
明天下午是否有4-5级的大风天	Weather-Query	明天 下午 是否 有 4 - 5 级 的 大风 天	11
查询后天乌镇紫外线指数	Weather-Query	查询 后天 乌镇 紫外线 指数	11
想知道西安六月末的紫外线指数	Weather-Query	想 知道 西安 六月 末 的 紫外线 指数	11
明天的悉尼我可以穿毛衣出去吗	Weather-Query	明天 的 悉尼 我 可以 穿 毛衣 出去 吗	11
有人说北京太干燥了但我觉得一点问题也没有	Weather-Query	有人 说 北京 太 干燥 了 但 我 觉得 一点 问题 也 没有	11
今天有没有多穿点衣服啊	Weather-Query	今天 有没有 多 穿点 衣服 啊	11
